[
  {
    "item_id": "chatgpt_query_openai_2025_estimate",
    "category": "text_inference",
    "unit_action": "one ChatGPT query",
    "low_wh": 0.17,
    "mid_wh": 0.34,
    "high_wh": 0.68,
    "water_low_ml": 0.161,
    "water_mid_ml": 0.322,
    "water_high_ml": 0.644,
    "source_url": "https://blog.samaltman.com/the-gentle-singularity",
    "source_date": "2025-06-10",
    "confidence": "medium",
    "notes": "Midpoint from OpenAI CEO statement. Low/high are provisional +/-100% uncertainty bounds until independent replication is added."
  },
  {
    "item_id": "gemini_prompt_google_2025_estimate",
    "category": "text_inference",
    "unit_action": "one Gemini prompt",
    "low_wh": 0.12,
    "mid_wh": 0.24,
    "high_wh": 0.48,
    "water_low_ml": 0.13,
    "water_mid_ml": 0.26,
    "water_high_ml": 0.52,
    "source_url": "https://cloud.google.com/blog/products/infrastructure/optimizing-ai-and-ml-workloads-for-environmental-sustainability",
    "source_date": "2025-09-08",
    "confidence": "medium",
    "notes": "Midpoint from Google estimate. Low/high are provisional +/-100% uncertainty bounds until scenario segmentation by prompt length/model is added."
  },
  {
    "item_id": "text_prompt_literature_wide_range_2025",
    "category": "text_inference",
    "unit_action": "one general LLM prompt",
    "low_wh": 0.3,
    "mid_wh": 1.83,
    "high_wh": 6.95,
    "water_low_ml": 10,
    "water_mid_ml": 30,
    "water_high_ml": 50,
    "source_url": "https://storage.googleapis.com/gweb-sustainability.appspot.com/assets%2Fpdf%2FSustainability_of_Generative_AI_Myth_vs_Fact.pdf",
    "source_date": "2025-09-08",
    "confidence": "low",
    "notes": "Derived from literature values summarized in Google white paper (Epoch AI, EcoLogits, Li et al.). Treated as broad scenario envelope, not a single-model estimate."
  },
  {
    "item_id": "image_generation_open_models_prelim_2025",
    "category": "image_inference",
    "unit_action": "one generated image",
    "low_wh": 0.127,
    "mid_wh": 0.768,
    "high_wh": 1.64,
    "water_low_ml": 0.025,
    "water_mid_ml": 0.538,
    "water_high_ml": 2.46,
    "source_url": "https://huggingface.co/spaces/AIEnergyScore/Leaderboard/blob/main/data/energy/image_generation.csv",
    "source_date": "2025-04-08",
    "confidence": "low",
    "notes": "Converted from AI Energy Score image rows assuming practical interpretation of leaderboard values as kWh per 1,000 images, then to Wh per image. Water estimated using provisional 0.2 to 1.5 mL per Wh conversion factor."
  },
  {
    "item_id": "video_generation_open_models_prelim_2025",
    "category": "video_inference",
    "unit_action": "one short generated video",
    "low_wh": 0.14,
    "mid_wh": 90,
    "high_wh": 415,
    "water_low_ml": 0.028,
    "water_mid_ml": 63,
    "water_high_ml": 622.5,
    "source_url": "https://www.emergentmind.com/articles/2509.19222",
    "source_date": "2025-09-24",
    "confidence": "low",
    "notes": "From a secondary summary of arXiv 2509.19222; values are placeholders until direct paper extraction is added."
  },
  {
    "item_id": "deepseek_v3_training_run_prelim_2024",
    "category": "training",
    "unit_action": "one full DeepSeek-V3 training run",
    "low_wh": 1500000000,
    "mid_wh": 2200000000,
    "high_wh": 3000000000,
    "water_low_ml": 300000000,
    "water_mid_ml": 1540000000,
    "water_high_ml": 4500000000,
    "source_url": "https://arxiv.org/abs/2412.19437",
    "source_date": "2024-12-27",
    "confidence": "low",
    "notes": "Anchored on reported 2.788M H800 GPU-hours. Energy range adds utilization and datacenter overhead assumptions. Water uses provisional 0.2 to 1.5 mL per Wh conversion factor."
  }
]
